{
  "version": "0.1",
  "taskId": "task_simple_admin",
  "page": {
    "name": "simple_admin",
    "width": 1440,
    "height": 900,
    "background": {
      "type": "color",
      "value": "#F3F4F6"
    }
  },
  "assets": [],
  "root": {
    "id": "root",
    "type": "frame",
    "role": "screen",
    "layout": {
      "x": 0,
      "y": 0,
      "width": 1440,
      "height": 900
    },
    "children": [
      {
        "id": "sidebar",
        "type": "shape",
        "role": "sidebar",
        "layout": {
          "x": 0,
          "y": 0,
          "width": 240,
          "height": 900
        },
        "style": {
          "fill": "#111827"
        }
      },
      {
        "id": "page_title",
        "type": "text",
        "role": "title",
        "layout": {
          "x": 280,
          "y": 48,
          "width": 240,
          "height": 32
        },
        "content": {
          "text": "订单管理"
        }
      },
      {
        "id": "table_card",
        "type": "frame",
        "role": "table",
        "layout": {
          "x": 280,
          "y": 112,
          "width": 1080,
          "height": 640
        },
        "style": {
          "fill": "#FFFFFF",
          "radius": 8
        },
        "children": [
          {
            "id": "table_header_line",
            "type": "line",
            "role": "divider",
            "layout": {
              "x": 0,
              "y": 56,
              "width": 1080,
              "height": 1
            },
            "style": {
              "fill": "#E5E7EB"
            }
          },
          {
            "id": "column_order",
            "type": "text",
            "role": "table_header",
            "layout": {
              "x": 24,
              "y": 20,
              "width": 120,
              "height": 20
            },
            "content": {
              "text": "订单号"
            }
          }
        ]
      }
    ]
  },
  "meta": {
    "source": "png",
    "platformHint": "admin_dashboard"
  }
}
